{
  "schema": 1,
  "updated_at": "2026-01-01T09:30:00Z",
  "cursors": {
    "sharing": null,
    "issues": null,
    "connections": "2026-01-01T09:14:00Z"
  },
  "sources": {
    "sharing": {
      "enabled": true
    },
    "issues": {
      "enabled": true,
      "states": [
        "open"
      ]
    },
    "connections": {
      "enabled": true
    }
  }
}
